-- Licensed under the Apache License, Version 2.0 (the "License");
-- you may not use this file except in compliance with the License.
-- You may obtain a copy of the License at
--
--     http://www.apache.org/licenses/LICENSE-2.0
--
-- Unless required by applicable law or agreed to in writing, software
-- distributed under the License is distributed on an "AS IS" BASIS,
-- WITHOUT WARRANTIES OR CONDITIONS OF ANY KIND, either express or implied.
-- See the License for the specific language governing permissions and
-- limitations under the License.
CREATE EXTENSION pgiceberg;
\pset format unaligned
\set VERBOSITY terse
DO $$
BEGIN
  PERFORM pgiceberg.add_catalog(
    'crud_regress',
    'sqlite',
    '/tmp/pgiceberg_catalog_crud_regress.db',
    '/tmp/pgiceberg_warehouse_crud_regress'
  );

  PERFORM pgiceberg.create_table(
    'crud_regress',
    'default',
    'trip_fixture',
    ARRAY['vendorid', 'passenger_count', 'trip_distance', 'store_and_fwd_flag'],
    ARRAY['bigint'::regtype, 'bigint'::regtype, 'double precision'::regtype, 'text'::regtype],
    ARRAY[true, false, false, false],
    true
  );
END $$;
CREATE SERVER iceberg
FOREIGN DATA WRAPPER pgiceberg
OPTIONS (
  catalog_type 'sqlite',
  catalog_uri '/tmp/pgiceberg_catalog_crud_regress.db',
  warehouse '/tmp/pgiceberg_warehouse_crud_regress',
  catalog_name 'crud_regress'
);
CREATE FOREIGN TABLE pgiceberg_trip_fixture (
  vendorid bigint,
  passenger_count bigint,
  trip_distance double precision,
  store_and_fwd_flag text
)
SERVER iceberg
OPTIONS (
  namespace 'default',
  table 'trip_fixture'
);
EXPLAIN (COSTS OFF)
SELECT vendorid, passenger_count, trip_distance, store_and_fwd_flag
FROM pgiceberg_trip_fixture;
QUERY PLAN
Foreign Scan on pgiceberg_trip_fixture
(1 row)
SELECT vendorid, passenger_count, trip_distance, store_and_fwd_flag
FROM pgiceberg_trip_fixture
ORDER BY vendorid;
vendorid|passenger_count|trip_distance|store_and_fwd_flag
(0 rows)
INSERT INTO pgiceberg_trip_fixture
VALUES
  (1, 2, 3.5, 'N'),
  (2, 1, 8.25, 'Y'),
  (3, NULL, 0.75, NULL)
RETURNING vendorid, passenger_count, trip_distance, store_and_fwd_flag;
vendorid|passenger_count|trip_distance|store_and_fwd_flag
1|2|3.5|N
2|1|8.25|Y
3||0.75|
(3 rows)
SELECT vendorid, passenger_count, trip_distance, store_and_fwd_flag
FROM pgiceberg_trip_fixture
ORDER BY vendorid;
vendorid|passenger_count|trip_distance|store_and_fwd_flag
1|2|3.5|N
2|1|8.25|Y
3||0.75|
(3 rows)
BEGIN;
INSERT INTO pgiceberg_trip_fixture
VALUES (4, 4, 4.0, 'R');
UPDATE pgiceberg_trip_fixture
SET passenger_count = 5
WHERE vendorid = 4;
SELECT vendorid, passenger_count, trip_distance, store_and_fwd_flag
FROM pgiceberg_trip_fixture
WHERE vendorid = 4;
vendorid|passenger_count|trip_distance|store_and_fwd_flag
4|5|4|R
(1 row)
ROLLBACK;
SELECT vendorid, passenger_count, trip_distance, store_and_fwd_flag
FROM pgiceberg_trip_fixture
ORDER BY vendorid;
vendorid|passenger_count|trip_distance|store_and_fwd_flag
1|2|3.5|N
2|1|8.25|Y
3||0.75|
(3 rows)
UPDATE pgiceberg_trip_fixture
SET passenger_count = passenger_count + 10,
    store_and_fwd_flag = 'U'
WHERE vendorid = 2
RETURNING vendorid, passenger_count, trip_distance, store_and_fwd_flag;
vendorid|passenger_count|trip_distance|store_and_fwd_flag
2|11|8.25|U
(1 row)
SELECT vendorid, passenger_count, trip_distance, store_and_fwd_flag
FROM pgiceberg_trip_fixture
ORDER BY vendorid;
vendorid|passenger_count|trip_distance|store_and_fwd_flag
1|2|3.5|N
2|11|8.25|U
3||0.75|
(3 rows)
BEGIN;
UPDATE pgiceberg_trip_fixture
SET passenger_count = 99
WHERE vendorid = 3;
SELECT vendorid, passenger_count, trip_distance, store_and_fwd_flag
FROM pgiceberg_trip_fixture
ORDER BY vendorid;
vendorid|passenger_count|trip_distance|store_and_fwd_flag
1|2|3.5|N
2|11|8.25|U
3|99|0.75|
(3 rows)
ROLLBACK;
SELECT vendorid, passenger_count, trip_distance, store_and_fwd_flag
FROM pgiceberg_trip_fixture
ORDER BY vendorid;
vendorid|passenger_count|trip_distance|store_and_fwd_flag
1|2|3.5|N
2|11|8.25|U
3||0.75|
(3 rows)
DELETE FROM pgiceberg_trip_fixture
WHERE vendorid = 1
RETURNING vendorid, passenger_count, trip_distance, store_and_fwd_flag;
vendorid|passenger_count|trip_distance|store_and_fwd_flag
1|2|3.5|N
(1 row)
SELECT vendorid, passenger_count, trip_distance, store_and_fwd_flag
FROM pgiceberg_trip_fixture
ORDER BY vendorid;
vendorid|passenger_count|trip_distance|store_and_fwd_flag
2|11|8.25|U
3||0.75|
(2 rows)
BEGIN;
DELETE FROM pgiceberg_trip_fixture
WHERE vendorid = 2;
SELECT vendorid, passenger_count, trip_distance, store_and_fwd_flag
FROM pgiceberg_trip_fixture
ORDER BY vendorid;
vendorid|passenger_count|trip_distance|store_and_fwd_flag
3||0.75|
(1 row)
ROLLBACK;
SELECT vendorid, passenger_count, trip_distance, store_and_fwd_flag
FROM pgiceberg_trip_fixture
ORDER BY vendorid;
vendorid|passenger_count|trip_distance|store_and_fwd_flag
2|11|8.25|U
3||0.75|
(2 rows)
TRUNCATE pgiceberg_trip_fixture;
ERROR:  cannot truncate foreign table "pgiceberg_trip_fixture"
\set VERBOSITY default
DROP FOREIGN TABLE pgiceberg_trip_fixture;
DROP SERVER iceberg;
DROP EXTENSION pgiceberg;
